"id","title","description","link","official_link","deadline","eligibility","host_country","host_university","program_duration","degree_offered","region","post_at"
"36","Commonwealth Distance Learning Scholarships 2025-26 | Fully Funded","The Commonwealth Distance Learning Scholarships 2025-26 in the UK is an outstanding opportunity for high-quality postgraduate students seeking professional development training in their key areas. Thesefully-funded scholarshipstarget those individuals who have the potential to develop practical skills but are unable to access training in their native countries. This Commonwealth scholarship helps students enrich their professional competencies during their study tenure and equip themselves with the latest competing skills while staying in their home country. The Commonwealth onlinescholarships for international studentsare designed for talented and vibrant students to attain the skills required to meet the standards of sustainable development. The Commonwealth Scholarships 2024 aims to identify individuals who cannot think of studying in the UK due to financial and other reasons. Considering the ongoing pandemic, these scholarships have brought forward a light of hope. The students get to work under the supervision of world-class mentors from top-ranked universities.  worldwide through a diversified community. The UK Government scholarship is being offered under the six themes. Science and technology for development ensure bringing developments in the economically torn regions. Strengthening health systems and capacity helps meet the health standards specified in the sustainable developmental goals. Promoting global prosperity helps nations by providing ways to curtail the obstacles coming to their development. Strengthening global peace, security, and governance contributes to firming the foundations of the countries. The Commonwealthmaster’s scholarship programis aimed at investing in the development of future qualifiers. These scholarships are sponsored by the Foreign Commonwealth and Development Office (FCDO), which intends to influence the UK’s development goals and widen overseas interests. The purpose of the commission is to support excellence in the higher education of the UK and comply with the Commonwealth’s principles. Further, the Commonwealth uses robust procedures to promote equity, discipline, inclusion, and diversity among its associates based on merit-based approaches.","https://scholarshipscorner.website/commonwealth-distance-learning-scholarships/","https://cscuk.fcdo.gov.uk/scholarships/commonwealth-distance-learning-scholarships-candidates/","","Candidates must be citizens or refugees or permanent residents from the eligible commonwealth country.Candidates must be British-protected individuals.Candidates must possess the first degree of at least upper second-class standard.Candidates who cannot afford to study in the UK otherwise.Candidates must provide one reference.Candidates must hold an offer to start their selected course of study.
CheckAustralia Awards Scholarships 2025-26 | Fully Funded","United Kingdom","","The duration of the Commonwealth UK scholarship is a maximum of five years.","Master’s Degree Program","Europe","2025-04-01"
"37","Bucharest Summer University 2025 in Romania | BSU 2025","Bucharest Summer University 2025 in Romania is a great opportunity for students from around the world. Students of any nationality or region are eligible to apply. This is the official summer program of the Bucharest University of Economic Studies, open to students at all academic levels, including bachelor’s, master’s, and Ph.D. candidates. This summer school in Europe offers an international platform for collaboration on current economic issues. BSU 2025 will feature field-related courses, seminars, debates, and workshops led by distinguished professors and experts. The program encourages participants to share their perspectives and work toward practical solutions to global challenges affecting people worldwide. It also provides a valuable opportunity to build connections and expand your professional and social network. This fully funded summer school also offers a cultural adventure, including guided tours of Bucharest, where students can explore Romania’s history, especially the communist era, and its lasting impact on society and culture. Participants will discover iconic landmarks, impressive architecture, wide boulevards, and charming narrow streets that reveal the city’s unique charm. Organized by the Bucharest University of Economic Studies, the program includes a variety of social activities designed to enhance your interpersonal, communication, and teamwork skills. While focusing on economic topics, this international academic and cultural event promotes shared educational values and cross-cultural exchange. BSU aims to foster idea-sharing, explore the economic challenges of the 21st century, and present innovative solutions to overcome them","https://scholarshipscorner.website/bucharest-summer-university/","https://bsu.ase.ro/apply/","2025-05-01","Everyone from any nationality can apply.Students of Bachelor, Master, or Ph.D. can apply.Make sure that your passport issuing country, the type of your passport, and your purpose for visiting Romania match all the requirements of the University.","Romania","","The duration of the BSU summer scholarship in Romania is two weeks.","","Europe","2025-04-01"
"38","King AbdulAziz University Scholarship 2025-2026 in Saudi Arabia | Fully Funded","King AbdulAziz University Scholarship 2025-2026  is offered to international students to study in higher education institutions in Saudia Arabia. Thisfully funded scholarship programis offering so many benefits which include allowances, accommodation, airfare, different university facilities like library, and health care facilities. This is an incredible chance to learn a new language while studying in Saudia. Students from all across the world can apply except the citizens of Saudi Arabia. KAU scholarships are offered for master’s and PhD students in a variety of faculties which have multiple departments. Programs offered in Master’s faculties include Arts and Humanities, Economics and Administration, Human Sciences and Designs, Education, Rights Law, Communication and Information/ Media, English Language, Engineering, Computers and Information Technology, Architecture and Planning, Sciences, Earth Sciences, Marine Sciences, Islamic Economics, and Maritime Studies. Scholarship programs for PhD include Arts and Humanities, Economics and Administration, Engineering, Computers and Information Technology, Architecture and Planning, Sciences, Earth Sciences, Marine Sciences, and Environmental Sciences.","https://scholarshipscorner.website/king-abdulaziz-university-scholarship/","https://graduatestudies.kau.edu.sa/Content-306-EN-278671","","Applicants should be Non-Saudi students living outside of Saudi Arabia.Applicants should have a university degree from an accredited institution.Applicants should have very good academic record.Graduation certificates & transcripts of applicants are required to be certified from Saudi Embassy.The Applicants applying for Masters program should not be more than 35 years.The Applicants applying for PhD should not be more than 40Applicants should have good contact and should be medically fit.Two recommendation letters from two former professors of the applicant should be submitted.The Applicant must not have been dismissed or expelled from any university of Saudia.English language test score is required for applicants whose first language is not English. (IELTS, TOEFL).Tests score validity will be for 2 years.Applicants who are applying for (MA or PhD) programs in Arabic Language and Islamic Studies are not required to take English language exam.","Kingdom of Saudia Arabia","","","","Middle East","2025-04-01"
"39","King Saud University Initiative 2025-26 in Saudi Arabia | Fully Funded Scholarships","King Saud University (KSU) in Riyadh is opening its doors to exceptional minds worldwide through the King Saud University Initiative 2025-26. This fully funded initiative is designed for individuals with strong academic backgrounds and research potential. Backed by Saudi Vision 2030, it aims to boost global scientific collaboration and strengthen the university’s role as a hub of innovation and excellence. The initiative offersfully funded scholarshipsto both local and international students pursuing PhD programs at KSU. It covers full tuition fees, a generous monthly stipend, on-campus housing, and health insurance. Students also receive relocation support and may be eligible to work in Saudi Arabia for one year after graduation. With world-class faculty and modern research facilities, this program creates a dynamic environment for academic and professional growth. King Saud University aims to attract top-tier graduate students who are passionate about research and innovation. This initiative not only enhances academic diversity but also nurtures interdisciplinary research, collaboration, and knowledge exchange. Students become part of a vibrant international community that is contributing directly to the future of education, research, and sustainable development in Saudi Arabia and beyond.","https://scholarshipscorner.website/king-saud-university-initiative/","https://dgsinitiative.ksu.edu.sa/","","To apply, candidates must meet the followinggeneral requirements:
Hold a Master’s degree from an accredited institutionEnglish proficiency:TOEFL iBT: Minimum 61IELTS: Minimum 6 (Clickhereto register for IELTS)STEP: Minimum 85(Waiver available for graduates from the US, UK, Canada, Ireland, Australia, or New Zealand)Two letters of recommendationCurriculum Vitae (CV) with a recent publication or patent (if available)A strong statement of purposeGRE general test is optional unless required by the specific programPersonal interview may be required (virtual or in-person)","Saudi Arabia","","","","Middle East","2025-04-01"
"44","Doha Institute Scholarships 2025 in Qatar | Funded","Doha Institute for Graduate Studies (DI) is offering a wide range of funded scholarships in Qatar to attract academically deserving candidates from both inside and outside the State of Qatar. There are different types of scholarships out of which some are provided based on academic merit and competition, while others are granted based on financial need. The Doha Institute scholarships is looking for graduate researchers and practitioners who can expand knowledge and improve the current condition of individuals by maintaining the greatest standards of research, professionalism, and ethics. The Institute uses a student-centered learning technique which encourages interdisciplinary research. It offers advanced leadership-focused training that highlights the skills required to meet the demands of intellectual progress and sustainable development in the region. Doha Institute promotes honesty and professionalism as well as the key principles of academic freedom. The Doha Institute for Graduate Studies (DI) offers scholarship programs for Masters and PhD students under the umbrella of its two schools which are the School of Social Sciences and Humanities and the School of Economics, Administration and Public Policy. Students are free to choose the program according to their interest and preference. Doha Institute offers a diverse range of 19 Masters Programs in thisscholarship program for international studentswhich include Public Policy, development Economics, Public Administration, Executive Master of Public Administration, EMBA/ EMPA Dual Degree Program, Clinical Psychology, Comparative Literature, Conflict Management and Humanitarian Action, Critical Security Studies, History, Human Rights, Journalism, Linguistics and Arabic Lexicography, Media Studies, Philosophy, Politics and International Relations, Social Psychology, Social Work, Sociology and Anthropology. The Doctoral Studies offers 8 academic programs which include History, Media Studies, Critical Security Studies, Political Science and International Relations, Linguistics and Arabic Lexicography, Sociology, Public Administration and Development Economics. Doha Instituteinternational scholarship programis offering Tamim scholarships which are offered on the basis of academic achievement and merit. These are awarded to the most distinguished citizens of Qatar as well as foreign scholars studying in the Arab world. Full tuition costs are covered by the scholarship, and international students from outside of Qatar will also get a monthly stipend, health insurance, and free housing in the institute’s dorms. The Sanad Scholarships are awarded based on students’ financial needs. These are granted to residents of Qatar, Qatari nationals, and foreign students. This scholarship will cover program’s costs from 10 to 100%. Foreign students residing outside of Qatar will get a monthly stipend, 100% tuition fee waiver, health insurance, and free housing in the institute’s hostels. Apply for this wonderful funded international scholarship in Doha before the applications are closed.","https://scholarshipscorner.website/doha-institute-scholarships-in-qatar/","https://www.dohainstitute.edu.qa/en/Admissions-Office/Pages/Scholarships.aspx","","All students have to apply through the scholarship application form which will be sent to eligible candidates by the Admissions office.Students should submit their application with all official and required documents mentioned in the form.Applicants can send only one application.Applicants should know both English and Arabic language.Kindly visit the official website for more details.","Qatar","","","","Middle East","2025-04-01"
"45","Harvard University MBA Scholarship Program 2025-26 in USA","Harvard University MBA Scholarship program 2025-26 is one of the best business scholarship programs when it comes to the level of learning and opportunities. Brilliant students from all over the world can have a bright chance to study at the world’s best university without paying any tuition fee due to this fully funded Harvard scholarship. Without thistop scholarship, most commendable students could never think of going to Harvard for higher studies due to its costly courses; but this scholarship has made this dream come true. Harvard University MBA scholarship is also known as the Boustany MBA Harvard Scholarship. This is because of the fact that the scholarship is being granted by the Boustany Foundation. The purpose of granting these scholarships at Harvard for international students is the betterment of mankind. The Boustany Foundation is eager to provide opportunities for better education to the students from less privileged classes. Moreover, the program also serves as a cultural exchange program because it is in the mandate of the foundation that the world must be a place where people can accept other cultures as well. The most prominent and distinguishing feature of this international scholarship at Harvard University is the internship at the Boustany Foundation. During their course study, the students are required to do a two-monthinternshipat the foundation. The students in this way get a sure chance to work on the projects of the Boustany Foundation and learn the practical realities of the world. This experience enhances their knowledge and skill in implementing the theory into practice. The fully-funded MBA scholarship is no doubt for those students who are not only excellent in their academics but they want to change this world into a better place to live in. it is the aim of the foundation to help those people who have the potential to bring positive impacts in the world full of chaos. The unique thing about this Harvard Scholarship is that this is not an annual scholarship but it is granted to the MBA students at Harvard after every two years.","https://scholarshipscorner.website/harvard-university-mba-scholarship-program/","https://boustany-foundation.org/scholarship-programmes/mba-harvard/","2025-05-01","Students of all nationalities can apply.Preference will be given to students of Lebanese descent.The students must be excellent in academics.The resume of the students must show their promising nature toward a better world.The students must be proficient in English.The students must have an offer letter from the Harvard UniversityFor more information about the Harvard MBA requirements, visit the official website of Havard Business school.","The United States of America","","","","North America","2025-04-01"
"48","Pierre Elliott Trudeau Scholarship in Canada 2025 | Fully Funded","The Pierre Elliott TrudeauScholarship in Canadainvites outstanding individuals from different fields and backgrounds to a community that transforms lives. Foundation Scholars will take part in different foundation activities such as conferences, master classes on leadership, training sessions, and seminars on public policy. Through these activities, students will be able to evaluate the practicality of their research. During this fully funded scholarship for international studentsin Canada, students will get inspiration from their fellows as well as gain insights from senior academics. Prominent mentor professionals will provide students with the guidance to manage the complexities of the non-academic world. They will encourage students to consider networking and communication outside of academia to maximize the real-world impacts of their research. Pierre Elliott Trudeau scholarship is looking for ambitious individuals who have no hesitation to their knowledge with everyone. The PhD work/ project of students should be related to Foundation’s general themes which include Human Rights and Dignity, Responsible Citizenship, Canada and the World, People and their Natural Environment. Students will receive generous stipend and additional allowances to cover the tuition fees and other living expenses for three years.","https://scholarshipscorner.website/pierre-elliott-trudeau-scholarship-in-canada/","https://www.trudeaufoundation.ca/become-a-scholar","","Applicants applying:
Should be a Canadian national studying at any university in Canada.Should be a Canadian national who is studying at an international university outside Canada.Can be an international student who is studying at a university in Canada.Can be in the last year of Master’s program.Can be in the first year of PhD program.Can be in their second year of PhD program.Field of study should be related to the humanities, social sciences or human sciences.","Canada","","Last year of Masters and PhD, 3 years","","North America","2025-04-01"
"50","Top Fully Funded Programs for International Students","Scholarships Corner is your go-to platform for top fully funded programs for international students. If you want to save time and avoid missing out on top fully funded scholarship opportunities in Europe, the USA, Japan, or Canada,Scholarships Cornerhas compiled the best options for you, complete with application deadlines and links. With these opportunities, students from all around the world can study at prestigious institutions and gain international exposure without worrying about tuition fees, accommodation, or living expenses. The opportunities include fully funded scholarships, internships, leadership programs, exchange programs, free online courses, and short-term program This is a wonderful opportunity for international students to gain experience or study abroad in diverse and popular destinations such as the United Kingdom, United States of America, Canada, and Japan. By interacting and studying with students from around the world, you will gain valuable insights from their experiences. Working in teams will teach you to respect different opinions and suggestions. You can choose a fully funded fellowship, internship, or scholarship program that aligns with your interests from the opportunities listed. These programs offer a chance to enhance your leadership skills and communication abilities. The programs include diverse study methods that not only cover theoretical aspects but also incorporate hands-on learning through practical work, including presentations, role plays, interactive games, and quizzes. To keep the students engaged, there will be interactive activities like orientations, cultural events, formal dinners, and social nights. Students will have an enriched experience that they will cherish for the rest of their lives. These fully funded scholarships for undergraduate, graduate, and doctoral students are offered by top-ranking universities worldwide, which many students dream of attending. Along with earning a prestigious foreign degree, you will have the opportunity to form friendships with like-minded individuals, maintaining connections even after completing your studies and returning to your home country. You can collaborate with them on future ventures as well. Studying abroad at a foreign university offers countless benefits. If you’re ready to take advantage of these opportunities, select the best one for yourself and apply as soon as possible before the applications close.","https://scholarshipscorner.website/top-fully-funded-programs-for-international-students/","","","","","","","","North America","2025-04-01"
"51","Global UGRAD Program Pakistan 2025 in the USA | Fully Funded Exchange Program","The 1st Global Undergraduate Exchange Program started back in 2010 and was inaugurated by the United States Department of State’s Bureau of Educational and Cultural Affairs (ECA). It occurs every year for a short time but gives the participants unforgettable memories. All participants land in the United States of America as cultural Ambassadors of Pakistan, and the amazing part is that all participants get the chance to learn not only academics but also cross-cultural understanding. The Global UGRAD program is for undergraduate students studying at universities in Pakistan. It gives them a chance to spend a semester at a university in the U.S., where they can experience a different culture and education system through a non-degree program.","https://scholarshipscorner.website/global-ugrad-program-pakistan/","https://applications.usefp.org/programs/ugrad/app/","","A candidate must be a citizen of PakistanA candidate should be 18-24 years old.A candidate must be enrolled in an undergraduate program and committed to returning back to the home country after the program completion.A candidate must have strong leadership qualities.A candidate must be enthusiastic to learn about the culture of the United States.A candidate must have a good academic record, awards, community activities, and academic achievements.A candidate would be prioritized who has never traveled abroad on any scholarship program.A candidate must be good at English.","United States of America","","4-5 months (One Semester)","","North America","2025-04-01"
