"id","title","description","link","official_link","deadline","eligibility","host_country","host_university","program_duration","degree_offered","region","post_at"
"30","Eric Bleumink Scholarships in Netherlands 2026 | Fully Funded","Are you ready to prove your worth through competition-basedscholarships in Europe? Eric Bleumink Scholarships 2026 in the Netherlands is a wonderful opportunity for students, wishing to enroll in the Master’s degree programs in one of the best universities in the Netherlands. Get ready to compete in the fields of Masters in Arts, Masters in Science, and L.L.M. The quality-immersed educational system has been waiting for you to come and work together to benefit the Netherlands and your hometown. This Europeanscholarship for international studentsthrough the University of Groningen is a highly-ranked program across 11 faculties. More than 35000 students from over 100+ countries have joined the network and earned the fruits of a successful career through this platform. It will prove to be an amazing start to a meaningful profession while engaging in day-to-day challenging and society-relevant research. The best thing of this institute is the “Student for a Day” which is the orientation program day. It is designed with the vision to help those students who are reluctant to choose the degree program for themselves. TheMaster’s Degree scholarshipsin the Netherlands on free scholarship celebrate an educational festival each year through which connecting dots between teaching and learning is done. The theme is different each year, which is filled with diverse programs along with multiple educational approaches, ideas, and discussions. You will get the opportunity to meet with educators from different countries and come up with numerous solutions to the problems. Thefully funded scholarship opportunityabroad is given in the environment of a friendly and lively city where people are so welcoming that they will help you on every step in such a way that you will feel like staying in your home. Talking about the University of Groningen is recognized as a global research university with a good reputation across the globe. Its defined image is engrossed in Groningen, which you can practically experience while visiting the City of Talent.","https://scholarshipscorner.website/eric-bleumink-scholarships-netherlands/","https://www.rug.nl/education/scholarships/eric-bleumink-fund","2025-12-01","Must have received an admission letter before February 2025.Must have an excellent academic record.Must have letters of recommendation, declaring their academic excellence.Must have excellent grades during undergraduate studies.Must have excellent English language skills.Must have availability to attend the whole program.Must be in sound health.Must not be able to bear the finances of study.","Netherlands","University of Groningen","The Eric Bleumink Scholarship in the Netherlands is granted for a 1 or 2-year Master’s degree program.","","Europe","2025-11-01"
"32","DAAD Helmut Schmidt Programme 2026 in Germany | Fully Funded","DAAD Helmut Schmidt Programme 2026 is afully-funded scholarship programfor students from developing and emerging countries. This fully funded scholarshipprogram is well known globally as the Master’s Scholarship for Public Policy and Good Governance. The scholarship facilitates future leaders from developing countries, who are willing to promote democracy and social justice in their hometowns. In this way, social, political, and economic development will spread its roots in developing countries. On the path of the principles of good governance, highly qualified candidates are invited under the DAAD scholarships in Germany to get an education in law, economics, political science, public administration, and development studies. Thus, making them able to get leading positions in their home countries. TheDAAD scholarship in Germanyis here to meet the requirements of a public sector that is convulsed with multifaceted organizational challenges. With the demand for strategic policymaking, these opportunities help participants equip with the latest theoretical knowledge, related skills, and developmental specified training in the key fields. Young potential leaders are encouraged to pursue their careers in one of the best universities in Germany. It is one of the best scholarship in Europefor brilliant students who want to acquire leadership skills by engaging in a foreign environment. The Germangovernment scholarshippermits outstanding students of developing countries to deepen their career progression paths by imparting quality-oriented professional skills during the master’s program’s tenure. Further, it helps participants share their opinions and convince the fellows and other participants with practical solutions through their eloquent presentations. The aspirants get the chance to work together with diversified people and help contribute their part to the economy of their native countries in particular and Germany in general through their enhanced knowledge and capabilities to lead the world. The fully-fundedmaster’s scholarship for international studentswill help students learn professional leadership skills in an internationally acceptable refined environment while providing them with excellent educational post-graduation degrees. The German land is known for its diversity and inclusion as it welcomes all cultures, races, religions, genders, and social segments to come and become a part of the prestigious international scholarship program that is surrounded by numerous advantages including travel allowances, monthly stipend, study grants, and many more.","https://scholarshipscorner.website/daad-helmut-schmidt-programme/","https://www2.daad.de/deutschland/stipendium/datenbank/en/21148-scholarship-database/?detail=50026397","2025-07-31","List ofeligible countries.","Germany","","The program duration for the scholarship is a minimum of two years.","Master’s Degree Level. For more details visitInformation about the Master’s Courses.","Europe","2025-06-01"
"2","Global Opportunities with deadlines in October 2024","Do you want to study and gain international exposure but do not have the means to carry out your ambition? If yes, here is your chance to fulfill your dream with incredible Global opportunities offered by various countries. Explore these incredible opportunities which include fully funded scholarships for undergraduate students, masters’ students and PhD students, fellowship programs, fully funded exchange program, global essay competition and paid internship. Through these international scholarships and awards, students will have a chance to choose from a diverse range of degree programs offered by prestigious global universities. While studying, host organizations will fund their tuition fees, provide them air-fare, accommodation, living expenses and stipends to bear their additional expenses. Students will meet and greet fellow scholars from around the world where they will have a chance to teach and learn from each other. Winning international awards, trophies and certificates can add up to your academic journey as well as professional career paths. If you want to join an international scholarship program in UK, USA, Australia, Taiwan or South Korea, read through the details of these programs and choose the opportunity that best suits your academic and professional preference. By participating and winning the global essay competition, young students will get a chance to win a free trip to Japan and explore the beautiful and scenic sites of Tokyo.","https://scholarshipscorner.website/global-opportunities-with-deadlines-in-october/","https://scholarshipscorner.website/how-to-apply-for-chevening-scholarship/","","","","","","","Africa","2025-04-01"
"3","International opportunities with deadlines in September 2024","If you aspire to gain global experience, explore these international opportunities with deadlines in September 2024. The opportunities include fully funded scholarships, research internships, international fellowships, and exchange programs. These programs allow you to focus on your learning and development without worrying about expenses. With stipends, allowances, and tuition waivers, they offer an excellent chance to advance your career without financial stress. Theseopportunitiesfor international students provide opportunities to interact with peers from around the world, creating a positive lifelong impact. Paid internships help bridge the gap between host organizations and emerging global talent, allowing students to tackle global challenges. During international fellowship programs, young researchers gain access to state-of-the-art facilities, enabling them to conduct research without limitations. International youth summits provide a platform for students to showcase communication and presentation skills, boosting their confidence. By participating in these youth leadership programs, students play an active role in shaping our global future. Collaborating with multicultural communities encourages teamwork and goodwill among participants from diverse backgrounds. Host institutions plan activities that promote collaboration and respect for differing perspectives The fully funded scholarships are available for Bachelor’s, Master’s, and PhD students in countries like the USA, Canada, China, Taiwan, South Korea, UAE, and Germany. Fully funded scholarships cover tuition fees, travel costs, and living expenses, allowing students to focus on academic growth. Along with earning a formal degree, students can explore the local culture, architecture, landmarks, and cuisine of their host countries.","https://scholarshipscorner.website/international-opportunities-with-deadlines-in-september/","","","","","","","","Africa","2025-04-01"
"4","MEPI Tomorrow’s Leaders Program 2024-25 | Fully Funded","The Tomorrow’s Leaders Program, funded by the Department of State’s U.S.-Middle East Partnership Initiative (MEPI), provides fully funded scholarships for students in Egypt and Lebanon from economically deprived communities who reflect the cultural and regional diversity of the Middle East and North Africa (MENA). To provide participants with valuable knowledge and practical skills required for effective leadership, the Tomorrow’s Leaders Program has collaborated with the top American-style universities in Cairo and Beirut. Participants in the Tomorrow’s Leadership Program will get access to a dynamic community that provides a wide range of support systems such as mentorship and personal development programs. By enrolling at prestigious liberal arts universities such as the American University of Beirut, the American University in Cairo, and the Lebanese American University through thisfully funded scholarship for international students, students will get a chance to develop critical thinking skills and enhance their capacity to come up with creative solutions to the problems faced by their communities, the MENA region, and the global community. Tomorrow’s Leaders will apply their academic knowledge to practical situations through engaging internships, civic engagement initiatives, and enrichment courses, along with their outstanding academic work. Before thisinternational scholarshipfor undergraduate and graduate students starts, there will be upcoming information sessions by Tomorrow’s Leaders three university partners. These events will provide applicants with all the information they require to select the best school for them and prepare a compelling application for the Tomorrow’s Leaders Program. You will have a chance to interact with professionals of the Tomorrow’s Leaders Program team during these sessions. They will cover a wide range of topics, including eligibility criteria, necessary application materials, the numerous aspects of university life, and much more. Applicants will receive useful information about the many academic disciplines that are offered through this international scholarship program, campus safety, student clubs and athletics, and facilities on campus. Undergraduate students will have the opportunity to pursue a semester studying abroad in the US, where they can interact with locals, get fully immersed in American culture, and expand their perspective on the world. After completing Fully Funded MEPI Tomorrow’s Leaders scholarship programs, participants will become part of a network of more than 1,000 program alumni who are leaders in the Middle East and North Africa region. The tuition fee for both undergraduate and graduate scholarships is waived off 100%, along with free accommodation, health insurance, entry visa, a monthly stipend for participating in Tomorrow’s Leaders activities, textbook allowance, a laptop, 2 round-trip air tickets to home country per year, access to career-oriented workshops, internship opportunities and getting mentorship from the university faculty. What are you waiting for? Apply now for this amazing fully funded scholarship program before the applications are closed.","https://scholarshipscorner.website/mepi-tomorrows-leaders-program/","https://fhi360educationprograms.my.site.com/s/login/?ec=302&startURL=%2Fs%2F","","Medical school students are not eligible to apply.IELTS and TOEFL test scores are not needed at the time of submitting the application. You will need them later on if you get selected after interview.S. citizens and U.S. legal permanent residents cannot apply.Applicants should have 80% marks in previous academic history.Candidates should belong to one of the countries mentioned below.Graduate applicants have to complete and submit two separate applications while apply to the American University of Beirut and the American University in Cairo. One will be Tomorrow’s Leaders Program graduate application and the other will be separate application to the partner institution.","","","4 years of undergraduate and 2 years of graduate program.","","Africa","2025-04-01"
"6","UP Commonwealth Scholarship in South Africa | Fully Funded","As a research-focused university, the University of Pretoria (UP) is offeringfully funded scholarshipsin South Africa for candidates who can significantly advance its research goals from Commonwealth countries (excluding South African students) as part of South Africa’s commitment to the Commonwealth Scholarship and Fellowship Plan. The UP Commonwealth Scholarship is being offered based on leadership skills and academic achievements. UP has evolved into a vibrant academic community with faculty, staff, and students representing international societies and a variety of backgrounds and cultures. The goal of thisCommonwealth PhD scholarshipis to establish an environment that supports innovation and high-quality education and is well known for its outstanding academic programs, specially when it comes to its significant research endeavors. UP Doctoral Commonwealth Scholarship 2024-25 is offering a variety of top-notch academic programs aimed at empowering, inspiring, and revolutionizing the next generation of leaders. The research programs are offered in the fields of Law, Humanities, Education, Engineering, Built Environment and IT, Health Science, Veterinary Science, Economics and Management Science, Natural and Agricultural Sciences, and Theology and Religion. The devoted academic instructors are passionate educators who are motivated to help students succeed in their careers. The purpose of academic programs is to support the passion of researchers and direct them toward a prosperous and opportunity-filled future. The Commonwealth scholarship program for international students is ideal for those aiming to enhance their academic careers and seeking a rewarding academic experience. Apply now before the deadline approaches.","https://scholarshipscorner.website/up-commonwealth-scholarship-south-africa/","https://www.up.ac.za/funding/3237135/2025-up-doctoral-commonwealth-scholarship","","Applicants applying must:
Be citizens of Commonwealth countries excluding South Africans.Acquire their studies at the University of Pretoria and start in 2025.Submit an application to study at UP in 2025 academic year.Have selected a potential supervisor.Submit their academic records to the South African Qualification Authority (SAQA).Have completed their postgraduate/Masters degree in the previous two years to apply to UP for admission in 2025.Not be older than 40 years.PhD and Masters students who are registered or who have previously studied at the University of Pretoria can not apply for this scholarship.","South Africa","","3 years","","Africa","2025-04-01"
"7","Fully Funded Scholarships for International Students 2024","Are you ready to embark on a journey full of learning and adventure? If so, you’ve come to the right place because we’ve got you covered with fully funded scholarships for international students in 2024 from around the world. We’ve curated the top scholarships for those seeking funded opportunities to enhance their career growth and personal development. Yes, you heard it right! These scholarships are fully funded, meaning you won’t have to spend a penny to avail of them. We know you’re excited to hear this. Whether you’re interested in academic scholarships, international fellowship programs, award scholarships, or peace fellowship programs, this article features the best opportunities for international students. Imagine being awarded the best scholarship and living abroad in one of the world’s most popular travel destinations, such as the UK, Singapore, Canada, Thailand, the United Arab Emirates, Azerbaijan, or Australia. Upon participating in these scholarship programs, you’ll have the opportunity to network with like-minded individuals from around the world. Everyone dreams of receiving a scholarship in a foreign country. If you’re one of them and have always wanted to learn more about diverse cultures, then you must apply to these programs. Undoubtedly, receiving a scholarship to study abroad will involve a variety of extracurricular activities that will enhance the educational experience. All application and tuition expenses for these exceptional scholarships are fully funded, making them 100% tuition-free opportunities. In some cases, stipends will be provided to cover living expenses, eliminating any financial worries. These fully funded scholarships for international students can serve as a gateway to kickstart their professional journeys in top-notch institutions worldwide. Whether you have destinations like the UAE, Australia, Canada, Thailand, Singapore, or Azerbaijan on your bucket list, this is a wonderful opportunity to make your dreams come true. There’s always more to discover in these fascinating places. One of the best aspects of these programs is their inclusivity, welcoming students from diverse academic backgrounds and nationalities. Your foreign journey full of fun and adventure awaits you. Apply now and thank us later.","https://scholarshipscorner.website/fully-funded-scholarships-for-international-students/","","","","","Type:Fully FundedDeadline:1stApril, 2024Host Country:AzerbaijanLocation:BakuProgram Level:Undergraduate and GraduateFor more details visit:ADA University Scholarshipsin Azerbaijan","","","Africa","2025-04-01"
"9","List of the Top Scholarships for African Students 2023-24","Scholarships for African Students to study around the world are an amazing opportunity for the students residing in Africa. You will get the chance to study on scholarships in Africa, Europe, Asia-Pacific, and the United States. The global institutes and different organizations have introduced multiple scholarship opportunities for undergraduates, graduates, and Ph.D. students to embark on incredible careers in the future. Hardworking, brilliant, and devoted individuals are welcome to participate in different scholarship programs. You can spend your dream life here without thinking about the financial pressure that has stopped you continue your studies. Theinternational scholarshipsto study across the world in different places is praiseworthy, and these scholarships are considered to be the best way to reach there. By discovering the paths of different cultures and beautiful landscapes, you can develop your personality professionally. Quality education in world-class institutes will help you advance your professional skills to grow in any sphere of life. You will get the opportunity to enhance your academic knowledge in the well-reputed institutes of the globe. Therefore, you must avail this opportunity as it will transform your career drive. By offering you the opportunity to engage in the numerous disciplines under the African scholarships worldwide, you will be able to establish a strong relationship with the people of other continents. This will help teach religious and cultural tolerance among the people, and they will be able to make the constellations of intellectuals from the different corners of the globe. These scholarships will allow you to meet your basic living requirements in other countries, and you will be able to make valued contributions to the economic growth of the country and the world. The various programs are available for the African students under the African scholarship program to allow them to taste the fruits of success while living or working in an internationally recognized friendly environment. The quality education and professional expertise of the international education systems are attracting bright African students to their region to harness their potential for growth in Africa. Moreover, the world-class mentors are always ready to help you complete the subject-related assignments and projects. Thus, helping you in widening your thoughts in productive and solution-focused ways. The international scholarships for African students are narrated below. You can check the eligibility criteria and objective of the scholarship before pursuing the application","https://scholarshipscorner.website/scholarships-african-students/","","","","","","","","Africa","2025-04-01"
"10","Top 10 Affordable Countries to Study Abroad in 2022-2023","Dreaming of studying abroad and looking for top affordable countries to study abroad? The wonderful opportunities are always waiting for you to explore the knowledge of your key area of interest. These opportunities will help you deepen your academic knowledge and develop the professional skills that are required for the current era of professional advancement. Highly qualified, devoted, and career-driven individuals are encouraged to grab competitive opportunities around every nook and corner of the globe to harness their potential in a better way. Some of the opportunities are fully funded and others are either partially funded or fully paid. Depending upon your financial circumstances, you can choose the country where you wish to continue your higher education. The opportunity to study in the most attractive and peaceful nations of the world is a creditable option for all those who are actively seeking their future in international academics. These nations provide you with a well-versed environment that is always helpful in nurturing your personality. The quality education, which is given through their educational systems is an attractive feature for grabbing the intellectuals from all regions of the globe. Moreover, your mesmerizing educational visits around the country along with the subject-specific assignments and projects will help you broaden your views on the key challenges of the particular subject and further help you produce realistic solutions. The best educational opportunities are available in the top-class renowned universities and institutions of the most captivating land. The various fields are being offered subject to the fulfillment of eligibility criteria. These international studying opportunities in the most eye-catching countries aim to make everyone aware of the wonderful avenues in all countries as they were never informed about before. These countries had lost many bright talents in the past due to the negligence of awareness on people’s end. While working with people of diverse backgrounds, you will be able to learn about their cultural values and about the citizens of the chosen country also. When you plan to study abroad, the first question that comes into mind is the selection of country over the programs and the fields of study. A number of countries are offering multiple scholarship opportunities at all levels from graduation to post-graduation and doctoral, it becomes difficult to choose which country is fulfilling your academic and other socio-cultural needs. Here is the list of all those countries where both living and education are affordable to meet your career goals. This list will help you understand the dynamics of each country and make it easier for you to select the best option among all available options.","https://scholarshipscorner.website/top-10-affordable-countries-study-abroad/","","","","Among all Nordic countries, Norway is beings considered an affordable destination for getting an int","","","","Africa","2025-04-01"
