"id","title","description","link","official_link","deadline","eligibility","host_country","host_university","program_duration","degree_offered","region","post_at"
"20","UI Great Scholarship 2025 in Indonesia | Fully Funded","The UI Great Scholarship 2025 is afully funded opportunity for international studentsto pursue a master’s degree at Universitas Indonesia (UI), one of the leading universities in Asia. This scholarship covers tuition fees, living costs, visa support, and more, making it an excellent chance to study in Indonesia. Students from all over the world can apply and benefit from this program designed to support academic excellence. This prestigious scholarship allows students to choose from a wide range of disciplines, including medicine, law, engineering, business, social sciences, and more. The scholarship supports talented students who demonstrate outstanding academic performance and a strong desire to contribute to their field. With full financial coverage, scholars can focus on their studies without worrying about expenses, while experiencing Indonesia’s diverse culture and rich heritage. The UIscholarship for international studentsensures a high-quality education at Universitas Indonesia, recognized globally for its academic excellence and research contributions. The scholarship includes a four-semester tuition fee waiver, monthly living allowance, visa and travel support, and health insurance coverage. Additionally, students needing Bahasa Indonesia proficiency will receive one year of language training before starting their degree, fully covered by the scholarship.","https://scholarshipscorner.website/ui-great-scholarship-indonesia/","https://admission.ui.ac.id/","","","Indonesia","Universitas Indonesia (UI)","","Master’s Degree","Asia","2025-04-01"
"23","University of Sydney RTP Scholarship 2024-25 | Study in Australia","The Research Training Program RTPscholarship in Australiavalued at up to $143,881, is funded by the Australian Government and is intended to support exceptional international research student by paying tuition fees and providing a stipend for living expenses. The University of Sydney is ranked #1 in sustainability, social impact, and educational impact in addition to being exceptionally prominent in a wide range of academic fields, including business, engineering, geography, technology, arts, architecture, and education. The range of topics covered by university research centre is broad and diverse, ranging from nano science to linguistics. Comprehensive disciplinary knowledge supports the depth of expertise throughout the faculties and schools. The institute has significant capability in more than 20 important research fields. Researchers from all around the world come together as part of multidisciplinary projects to tackle some of the most critical global issues, such as youth mental health, chronic illness incidence rising, and climate change. Thisinternational postgraduate scholarshipwill provide students the opportunity to learn and gain experience  from other fellows researchers. Sydney Indigenous Research Hub provides growth and mentorship for faculty members and students pursuing higher degrees in research, as well as coordination and support for all Indigenous research at the university. You can find research and researchers there, as well as acquire new skills, expand your research networks, find a mentor, and generally experience about research that is relevant to Indigenous people globally. This Research training program scholarship will provide a perfect environment for conducting your all research related activities. Areas for the University of Sydeny scholarships include include Agricultural and veterinary sciences, Biological sciences, Built environment and design, Chemical sciences, Commerce, management, tourism and services, Creative arts and writing, Earth sciences, Economics, Education, Engineering, Environmental sciences, History and archaeology, Human society, Informational and computing sciences, Language, communication and culture, Law and legal studies, Mathematical sciences, Medical and health sciences, Philosophy and religious studies, Physical sciences, Psychology and cognitive sciences, and Technology. Choose the field of your interest and start your journey of  researchScholarships in Austrliabefore the deadline approaches.","https://scholarshipscorner.website/university-of-sydney-rtp-scholarship/","https://www.sydney.edu.au/scholarships/e/australian-government-rtp-scholarship-international.html#:~:text=The%20Scholarship%20may%20be%20held,maximum%20tenure%20of%20the%20award","","RTP scholarships are very competitive and are awarded based on academic merit.Research publications will also be highly considered.Applicants can be a new or already enrolled international postgraduate research student.Applicants must have an excellent record of academic achievement and should have research potential.Candidates should have an unconditional admission offer letter or should be currently enrolled in a master’s degree or PhD at the University of Sydney.","Australia","","5 years for Research Doctorate, 1.75 years for Research Master’s studies..","","Australia","2025-04-01"
"26","Melbourne International Undergraduate Scholarship 2024 in Australia","Melbourne International Undergraduate Scholarship is awarded to those who have excellent academic results. This scholarship for international students in Australia welcomes students from every nationality other than Australia and New Zealand to continue their studies without any financial pressure on their minds. The Melbournescholarships in Australiaare awarded every year to approximately 50 self-motivated, exceptional, and highly talented students. The University of Melbourne has prominence in high achievements in every field of study. It has produced the best professionals and researchers in the world by collaborating with its international partners. Moreover, Melbourne University engages the staff and students to think big and empowers them to talk and act on sustainability issues with sheer confidence and knowledge. Therefore, the Melbourne International Undergraduate grant allows students to experience world-class learning under the supervision of experts and technicians in related fields. The University of Melbourne, Australia, is one of the leading as well as the safest place for students to study. To cope with the changing dynamics of the world. the university has developed a sustainable plan which is designed to make the campuses more sustainable. The plan allows the students, staff, and researchers to make valuable contributions to this challenging world. This is a great chance for talented students to participate in all these progressive strategies and learn to implement them in their real lives. The following article comprises detailed information about the benefits of the Melbourne University Scholarship 2024 to academically bright students. Although the application procedure is simple, the article also contains complete guidance in order to prevent any inconvenience to the applicants. In addition to all these, the complete eligibility criterion is being discussed along with the required academic grades. As the University of Melbourne is a study destination for international students.","https://scholarshipscorner.website/melbourne-international-undergraduate-scholarship/","https://scholarships.unimelb.edu.au/awards/melbourne-international-undergraduate-scholarship","","The applicant must be an international student and not a citizen of Australia or New Zealand.The applicant must not be a permanent resident of Australia.The applicants must have already received an offer letter from the University of Melbourne.The applicant must have received top high secondary school grades or equivalent that place the applicant in the top 3% such as:3A* in A-levels (At least 93%)In Australian Foundation studies at least 98%.In International Baccalaureate at least score 42.According to US High School at least a GPA of 3.9 and along with SAT of at least 1500 and an ACT of at least 31.According to Canada Secondary School an overall score of 97%.According to India Secondary School an overall score of at least 95%.In Vietnam High School an overall score of at least 90%.The student must not have undertaken any previous tertiary studies.","Australia","University of Melbourne","4 years of duration","Undergraduate","Australia","2025-04-01"
"27","Western Sydney University Research Scholarships in Australia 2024","Western Sydney University Research Scholarships provide a splendid opportunity for outstanding students to study in Australia without paying any tuition fee. This unique scholarship opportunity is released periodically and remains open at various times throughout the year. Moreover, these scholarships provide a handsome amount of stipend so that the students can focus on their research work without having any financial burden on their shoulders which could be a potential hindrance in their research. One thing to keep in mind is that each type of international scholarship has its own eligibility criteria and closing date along with other requirements. This funded research scholarship in Australia is for both domestic as well as for international students. However, the scholarships are highly competitive because the Western Sydney University Scholarship Assessment Panel reviews and endorses scholarship offers that are entirely based on meeting entrance criteria and recommendations put forward by Schools and Institutes. Then on the recommendations given by the Western Sydney University HDR Scholarship Assessment Panel, the Deputy Vice-Chancellor of Research Enterprise and International approves the scholarship offers. The competitiveness of this funded national and international program makes it a hallmark that shows the potential of its selected researchers for future work and careers. Western Sydney University Scholarships in Australia 2024 are awarded for full-time study in Australia and research students of Doctor of Philosophy (PhD), Professional Doctorate (DCA, DCR or EdD), and Master of Philosophy (MPhil) can avail of this opportunity. As the scholarships include multiple courses available at different times, there are high chances that one can grab one’s desired research work. However, one must check from time to time to get knowledge about the open scholarships relevant to one’s own course and research from the official website of Western Sydney University Research Scholarships. To come to Australian Universities on a funded basis is a golden opportunity to study in world top class institutes where without funding study could be difficult. This wonderful scholarship opportunity not only provides a fee waiver along with a very handsome amount of stipend but also allows the researcher to work 10 hours a week as well. Getting a work permit during study is a unique chance a very few universities in the world allow. With this permission, the researchers can get practical experience of the working of the world outside their institutes of study. Also, this type of work experience can help the students to grow in their careers prior to the completion of their degrees or courses. So, if one is eligible, there is no reason to miss this extraordinary opportunity.","https://scholarshipscorner.website/western-sydney-university-research-scholarships-in-australia/","https://www.westernsydney.edu.au/future/study/how-to-apply/higher-degree-research-candidates/how-to-apply-for-a-research-scholarship","","The scholarships are open for both domestic and international students.The selected candidates must be onshore in Australia at the scholarship commencement date.International students must have valid visas till the date of completion of the granted program.The candidates are eligible to apply for a Doctor of Philosophy (PhD), Professional Doctorate (DCA, DCR, or EdD), and Master of Philosophy (MPhil).The candidates who completed their previous qualifications outside of Australia have to provide evidence of English language proficiency.
CheckHong Kong PhD Fellowship Scheme 2024-25 | 300 Fully Funded Fellowships","Australia
Host University:
Western Sydney University Research Scholarships","","","","Australia","2025-04-01"
"29","Global Leaders’ Scholarship Program in UK 2025 | Full Scholarship","Stephen Young Global Leaders’ Scholarship Program (SYGL) 2025 will award full scholarship to outstanding students enrolled in MBA at University of Strathclyde Glasgow. ThisMBA scholarshipis all about building strong leadership skills. It’s designed to help scholars become leaders who make a positive impact and support responsible, sustainable business growth. Students will get coaching and support by a business leader, CEO or any senior executive of a renowned company with an industry focus. In this MBA scholarship in UK, students will get a chance to take advantage from various leadership factors through Stephen Young Institute (SYI) and become a member of SYI community. Thisinternational scholarshipof practical learning will support students’ development as future global leaders. SYGL scholarship Program in Europe will help participants to acquire critical competencies which are important in today’s competitive and rapidly evolving global marketplace. During this fullscholarship program for international students, scholars can select one out of three opportunities offered to them in addition to their MBA studies. First is to attend a global MBA elective class in Europe, Middle East, or Far East which will provide airfare and accommodation. Second is to attend an international summer school in another partner university which will include air tickets and accommodation. Third is to take up a special research project defined by Stephen Business Institute.","https://scholarshipscorner.website/global-leaders-scholarship-program/","https://www.strath.ac.uk/studywithus/scholarships/stephenyounggloballeadersprogramme/#apply","","Applicants must meet the admissions criteria for the Strathclyde full-time MBA program.Applicants must receive an admission offer to study MBA program in the university before applying for the scholarship.Applicants have to apply separately to the Stephen Young Global Leaders’ Scholarship Program.Applicants should demonstrate excellent academic record in their scholarship application.Applicants must be self-funded students who do not have access to other funding sources.Short-listed candidates will have an interview (in-person or online).Duplicate applications will be disqualified.
CheckDAAD Helmut Schmidt Programme 2026 in Germany | Fully Funded","UK","University of Strathclyde Glasgow","Full-time MBA (1 year)","","Europe","2025-04-01"
"31","CICOPS Scholarships in Italy 2026 | Fully Funded","CICOPS Scholarships Program in Italy 2026 is offered by University of Pavia and EDISU to promote international cooperation with developing countries. Thisfully funded research programwill be held in University of Pavia for 4-12 weeks. Scholars have to submit their research proposals which will be evaluated by CICOPS. If the research project aligns with a research activity carried out at the host university, CICOPS will forward the research proposal to the relevant department. Scholars will work with university professors on their research projects. University of Pavia scholarship in Italy is offered in different departments which include Chemistry, Physics, Civil Engineering and Architecture, Electrical, Computer and Biomedical Engineering, Mathematics, Drugs Sciences, Earth and Environmental Sciences, Biology and Biotechnology, Brain and Behavioral Sciences, Internal Medicine and Therapeutics, Molecular Medicine, Public Health, Neuroscience, Experimental and Forensic Medicine, Clinical-Surgical, Diagnostic and Pediatric Sciences, Law, Economics and Management, Cultural Heritage, Political and Social Sciences, and Humanities. During this fully funded scholarship in Italy for international researchers, the hosting Department will provide access to various facilities for study and research activities which include libraries, computer facilities, and etc. After receiving declaration of acceptance from the scholars, University of Pavia will provide visa assistance, book a return flight ticket, provide health insurance policy and personal accident, arrange accommodation, provide a card for meals to be used at University canteens for free meals, and pay the contribution amount to the participants. After completing this short term research scholarship program in Pavia, scholars will have to prepare a report on the work they have completed at the host Department and submit the copies of any articles or publications.","https://scholarshipscorner.website/cicops-scholarships-italy/","http://cicops.unipv.it/cicops-scholarships/","","Applicants should have at least two years of teaching experience or activity within international organizations and institutions.Scholarships are offered to both junior and senior members of Universities in Developing Countries who have interest in the field of development studies.Applicants who are currently enrolled in a Doctoral or Postgraduate Course at an Italian University are not eligible to apply for this scholarship.Successful applicants should confirm acceptance of the scholarship within 20 days of receiving the mail of selection.For details information must visit theCICOPScall andFAQs.","Italy","","4-12 weeks","","Europe","2025-04-01"
"33","Oxford Clarendon Scholarships 2026 in the UK | Fully Funded","Oxford Clarendon Scholarships 2026 in the UK provides an outstanding opportunity to academically brilliant students from around the globe. The Clarendon Grant allows extraordinary students to study in Oxford for free. Thefully-funded scholarshipin UK is for every talented mind who can not afford otherwise to come to the world’s most prestigious institute for higher studies. This UK scholarship aims to fulfill the university’s mission to welcome the world’s brightest minds to its Oxford community. The Oxfordscholarship for international studentsin the UK was granted by the Clarendon Fund in 2001, the year the fund was established. The fund is sponsored majorly by the Oxford University Press to support the university’s vision of excellence in research and education. To successfully achieve the goals to fulfill the basic objective of Oxford University, every year 200 scholarships are granted to international students. Thus by promoting its mission, the Oxford University scholarship gives a life-changing chance to the students as well. Studying in the UK’s top university, itself is a matter of prestige and instills a high level of confidence in the students. Moreover, the Clarendon Scholarship Program 2025 is an outstanding platform at which long-lasting social, academic, and professional connections are built. The Clarendon scholars along with academic excellence also gain insights into the cultural diversity of the UK. The Oxford scholars become distinguished by attending a diverse range of events ranging from lectures and academic symposia to cultural outings. The outings include visits to theaters and places of historic importance all over the UK. The University of Oxford scholarships for graduate students support the students to focus on their studies by bearing all the financial costs that could potentially hinder the mental capabilities of the scholars. As the scholarship’s sole purpose and focus is to gather the best and brightest minds, the Clarendon Scholarships are highly competitive and are considered very prestigious in the Oxford community.","https://scholarshipscorner.website/oxford-clarendon-scholarships/","https://www.ox.ac.uk/clarendon","","Students of any nationality, race, ethnicity, or gender can apply.There is no subject restriction for this scholarship.The student must get admission to Oxford University for a graduate degree (master’s or DPhil).The students who are already doing master’s and want to study for another part-time master’s or another part-time DPhil at Oxford can also be eligible for scholarships. (The student must be currently studying at Oxford).Post-graduate courses and diploma courses are not eligible.Special considerations are given to the students who have potential academic reasons and aptitude to continue the selected courses.A candidate should select the program of his/her interest.All interested candidates are directed to first apply for admission to the master’s or doctoral program of the university.After applying for admission, the applicant would be automatically selected for the scholarship.","United Kingdom","University of Oxford","","Master’s Degree ProgramDPhil Degree Program/PhD","Europe","2025-04-01"
"34","University of Twente Scholarship 2025 in the Netherlands","The University of Twente Scholarship 2025 is a remarkable opportunity for students to pursue their higher education studies in one of the best institutes in Holland.The funded European scholarship seeks talented international students to join a group of fellows making a global impact. The UTscholarship in the Netherlands for international studentsis to lessen the financial burden off from the student’s shoulders The students have the chance to either do research work, design or be change leaders through thismaster’s scholarship in Europe. This exclusive chance to study abroad for free has a lot more attractions for the extraordinary students, for instance, the fellows would receive the best education from one of the best universities in Europe under the supervision of world-class mentors and professors. The University of Twente itself has a lot of diversity when it comes to courses, programs, students, and professors or mentors. The institute is an actual depiction of natural beauty surrounded by peace, calmness, and serenity. The campus is built on a huge piece of and is surrounded by woodland, meadows, and water, and is designed perfectly to soothe the minds of the students as well as the staff. Since its foundation in 1961, the University has been a hub for knowledge and research centers. Theseinternational scholarshipsin the Netherlands provide a platform where students can join the knowledge and research hubs of the University of Twente. These include the Center for European Studies, Twente Water Center, Max Plank Center for Fluid Dynamics, Center for Healthcare, Center for Clean Technology, Center for Ethics, Philosophy, and many more.","https://scholarshipscorner.website/university-of-twente-scholarship/","https://www.utwente.nl/en/education/scholarship-finder/university-of-twente-scholarship/#applicationrequirements","2025-05-01","The EU/EEA masters’ students, as well as non-EU/EEA students, can apply for this Holland scholarship.The UTS 2025 is not available for Dutch and/or current UT students.The applicant must not be already been graduated from UT.The applicant must be able to obtain an entry visa (if applicable).The applicant must fulfill the English Language Requirements i.e. IELTS 6.5, TOEFL iBT of 90 an additional 6.0 (TOEFL iBT 20).","Netherlands","","","Master’s Degree Program","Europe","2025-04-01"
"35","Netherlands Government Scholarship 2025-26 | NL Scholarship","The Netherlands Government Scholarship is an incrediblescholarship opportunity for international studentswho do not belong to the European Economic Area (EEA) and want to do their bachelor’s or master’s in the Netherlands. Several Dutch research universities and universities of applied sciences, along with the Dutch Ministry of Education, Culture, and Science, are funding this Europe scholarship. Students who will complete the Research Master’s program will be well-equipped to pursue a Ph.D. in their area of study after graduation, as well as secure advisory roles in both the public and private sectors. Through these Netherlands Scholarships for international students, brilliant individuals can study and live in one of the most enthralling nations in Europe while receiving an unmatched education. Students will take advantage of advanced training and research facilities, top-notch educational programs, and several international networking possibilities, in addition to having access to some of the most prestigious Dutch universities in the Netherlands. Students will get a chance to work on research projects related to their area of study that they wish to do. The Netherlands Government has partnered with 32 Dutch Universities that offer a variety of degree programs in this scholarship related to English language, International Relations, Psychology, Anthropology, Urban Studies, Philosophy, Linguistics, Data Science and Artificial Intelligence, Arts Media and Society, Law, Social Sciences, Marketing, Human Resource Management, Governance, Health wellbeing and Society, Supply Chain, Accountancy, Economics, Business Analytics and Operations Research, Business Taxation, Quantitative Finance, Child psychology, Econometrics, Entrepreneurship, Communication and Cognition, Ethics of Business and Organization, Engineering and Innovation. Students will get to explore landmarks of Europe while residing there which otherwise is merely a dream for many individuals due to financial constraints. With NetherlandsGovernment Scholarshipin your hands, this is a fantastic chance to advance your academic career and learn a new skill set. These will be helpful in the professional life and overall personality development of students. Any student who wants to achieve success in their chosen sector should use it as an expedient chance.","https://scholarshipscorner.website/netherlands-government-scholarship/","https://www.studyinnl.org/finances/nl-scholarship","","Applicants applying must:","Netherlands","32 different Dutch Universities","","","Europe","2025-04-01"
