"id","title","description","link","official_link","deadline","eligibility","host_country","host_university","program_duration","degree_offered","region","post_at"
"52","University of Hawaii ADB Scholarship in USA 2025 | Fully Funded","The University of Hawai’i ADB Scholarship is a prestigious andfully funded opportunityfor international students seeking advanced education in the United States. This scholarship is offered through a collaboration between the Asian Development Bank (ADB) and the University of Hawai’i, providing students from ADB member countries with the chance to pursue postgraduate studies. The Asian Development bank scholarship program aims to equip scholars with the skills and knowledge necessary to contribute to the economic and social development of their home countries. Thismaster’s degree scholarshipcovers a wide range of expenses, making it an attractive option for eligible students. It includes full tuition fees, round-trip airfare, a monthly subsistence allowance, and coverage for health insurance, books, and other essential materials. Additionally, the program provides a special allowance for research and field study, ensuring that scholars have all the resources they need to excel academically. One of the unique aspects of the University of Hawai’i Scholarship is its emphasis on leadership development. Scholars are not only expected to excel in their academic pursuits but also to contribute to their communities and lead initiatives that promote sustainable development. The program encourages scholars to engage in activities that build their leadership skills, preparing them to become influential figures in their respective fields. Thisfully funded scholarship in USAis open to students from diverse backgrounds, offering them the opportunity to study in a multicultural environment at the University of Hawai’i. The university is known for its strong academic programs, particularly in areas such as sustainable development, economics, and environmental management. By providing financial support and access to world-class education, the University of Hawai’i ADB Scholarship empowers students to make a meaningful impact in their home countries and beyond.","https://scholarshipscorner.website/university-of-hawaii-adb-scholarship-usa/","https://www.eastwestcenter.org/apply/asian-development-bank-japan-scholarship-program","","The United States of AmericaSoutheast Asia:Brunei, Burma, Cambodia, Indonesia, Laos, Malaysia, Philippines, Singapore, Thailand, Timor-Leste, VietnamSouth Asia:Afghanistan, Bangladesh, Bhutan, India, Iran, Maldives, Nepal, Pakistan, Sri LankaPacific Region:American Samoa, Australia, Cook Islands, Federated States of Micronesia, Fiji, French Polynesia, Guam, Kiribati, Marshall Islands, Nauru, New Caledonia, New Zealand, Niue, Northern Marianas, Palau, Papua New Guinea, Samoa, Solomon Islands, Tokelau, Tonga, Tuvalu, Vanuatu, Wallis & Futuna IslandsEast Asia:China, Hong Kong, Japan, Macau, Mongolia, North Korea, South Korea, Russia, Taiwan","United States","","","Master’s Degree Program","North America","2025-04-01"
"53","Top Fully Funded Scholarships for International Students 2024-25","Are you tired of scrolling here and there while looking for incredible top fully funded Scholarships, Scholar program or a prestigious Graduate Award? It’s time for you to have a sigh of relief because as always Scholarships Corner has listed fully funded scholarship programs along with the deadlines and application links. Exciting enough? Thesetop scholarshipsfor international students will give an opportunity to students from across the globe to earn a foreign degree along with gaining international exposure without worrying about academic expenses. The United Kingdom, United States of America, Canada, Germany and China are some of the most diverse countries in the world as they offer individuals from different cultures, ethnicities, and nations to study in their best educational institutions on scholarships. If you are interested in learning about different cultures and languages and are eager to interact and study with international students, you should not miss this chance of grabbing a fully funded opportunity in Europe, USA, China and Singapore that best suits your interest and preference from the list given below. During these bestscholarshipsfor undergraduate, graduate and PhD students, candidates will get a chance to learn about leadership development initiatives, educational enrichment events, cultural exchanges, team-building activities, community service, and service-learning projects through these programs. So, it’s not just a benefit on the academic side only, but you will also get to develop and groom your overall personality. The clock is ticking, Hurry up! Apply now before the deadlines approach.","https://scholarshipscorner.website/top-fully-funded-scholarships-for-international-students/","","","","","","","Type:Fully FundedDeadline:1st December, 2024Host Country:USAHost University: University of Hawaii (UH)For more info visitEWC Scholarship in USA","South America","2025-04-01"
"54","Top 10 Fully Funded Scholarships of 2023 | Study Abroad Opportunities","Are you trying to pursue your education abroad? The tremendous scholarship opportunities have been waiting for you to apply and choose the area of your interest to enrich your knowledge in the selected domain. These top 10fully-funded scholarshipswill not only vast your academic learning but also help you inculcate the desired professional skills that are the basics of current professional advancement in the world of digitization and technology. Brilliant-minded, committed, and career-oriented candidates should apply for merit-based scholarships in Canada, the US, the UK, Germany, Thailand, and Singapore. These international opportunities are fully funded by the sponsored institutions. The scholarship to study in the top educational institutions of the globe is a worthy option for you if you are eagerly seeking your future in the international academic world. The top-ranked universities at different corners of the Earth will provide you with a quality-oriented environment that is helpful in nurturing your personality. Students from all fields are encouraged to be a part of the educational network while curbing the hurdles of finances, they have been facing in their way of getting higher education. Further, you will be able to widen your views towards the people and culture of the particular country. In this way, you can also choose to work in the same country or return to your hometown. These best educational opportunities in different countries are now easily accessible to you through top-class universities and institutions. The multiple disciplines are being offered free of cost. All you need is to see the eligibility criteria of the university and apply through the proper given channel. The opportunities are available at the following different levels of education: under graduation, graduation, and post-graduation. When it comes to choosing the institute and country which will be worthful in your future journey, you get confused among the available options. Here, we are presenting all the global opportunities to you on the same page. This page will help you go through the pros and cons of each university and the country to drive you towards the best. The topscholarships for international studentsin Germany, the UK, the USA, Thailand, and Singapore have been discovered for you by their governments and sponsored institutions through their academic universities. Following is the list of all study opportunities in Europe, Asia, and North America on fully funded scholarships. You can read the details of the scholarships below and find out the match to excel in the relevant area of your interest.","https://scholarshipscorner.website/top-10-fully-funded-scholarships/","","","","","","","","South America","2025-04-01"
"55","NUS Amgen Scholars Program 2025 in Singapore & Japan | Fully Funded","NUS Amgen Scholars Program seeks to motivate the next generation of innovators through practical summer research opportunities at world-class educational and research institutions. Thisfully funded scholarship programhas been introduced in the US, Europe, Japan, and now Singapore. One of the recent additions to the list of top universities in Asia providing this prestigious degree is the National University of Singapore (NUS). The main goal of thisundergraduate scholarship programis to support students who want to pursue careers in biology or related fields. This international scholars program includes 8 weeks of comprehensive biomedical or biotechnological research experience in the basic and translational sciences. Faculty from the Department of Biological Sciences, and other partner departments from the National University of Singapore will share their experiences and provide research training to the scholars. During this scholars program for Asian students, participants will attend information sessions related to Graduate Program opportunities with the National University of Singapore. Students will attend weekly conferences and seminars where they can meet and interact with scientist guest speakers. The program will give access to multiple campus facilities including Library, University Health Services and Sports Centre. This summer research program will be an incredible learning journey with a chance to have different social gatherings and trips.","https://scholarshipscorner.website/nus-amgen-scholars-program/","https://forms.office.com/pages/responsepage.aspx?id=Xu-lWwkxd06Fvc_rDTR-gpFFxv9Ss2NAvmfXDfZJegZUOTZRR1c1TTNaVUxDRDFFTFBORDlBSTcwWi4u&route=shorturl","","Applicants applying:
Should have interest in life science research particularly in the biotechnology and biomedical fields.Should meet all eligibility criteria before applying.Must be currently studying in an Asian university.Should attach all the documents with their application form mentioned in the application checklist.Cannot do any job or take any other courses during the program.Should attend the complete program including the Symposium.Must attend the orientation, all the conferences, activities and social events.Have to provide a written report after completing their research project.","Singapore","","May 2025- August 2025","","USA","2025-04-01"
"56","Top Fully Funded Scholarships for International Students 2024-25","Are you tired of scrolling here and there while looking for incredible top fully funded Scholarships, Scholar program or a prestigious Graduate Award? It’s time for you to have a sigh of relief because as always Scholarships Corner has listed fully funded scholarship programs along with the deadlines and application links. Exciting enough? Thesetop scholarshipsfor international students will give an opportunity to students from across the globe to earn a foreign degree along with gaining international exposure without worrying about academic expenses.  The United Kingdom, United States of America, Canada, Germany and China are some of the most diverse countries in the world as they offer individuals from different cultures, ethnicities, and nations to study in their best educational institutions on scholarships. If you are interested in learning about different cultures and languages and are eager to interact and study with international students, you should not miss this chance of grabbing a fully funded opportunity in Europe, USA, China and Singapore that best suits your interest and preference from the list given below.  During these bestscholarshipsfor undergraduate, graduate and PhD students, candidates will get a chance to learn about leadership development initiatives, educational enrichment events, cultural exchanges, team-building activities, community service, and service-learning projects through these programs. So, it’s not just a benefit on the academic side only, but you will also get to develop and groom your overall personality. The clock is ticking, Hurry up! Apply now before the deadlines approach.","https://scholarshipscorner.website/top-fully-funded-scholarships-for-international-students/","","","","","","","Type:Fully FundedDeadline:1st December, 2024Host Country:USAHost University: University of Hawaii (UH)For more info visitEWC Scholarship in USA","South America","2025-04-01"
"57","Netherlands Government Scholarship 2025-26 | NL Scholarship","The Netherlands Government Scholarship is an incrediblescholarship opportunity for international studentswho do not belong to the European Economic Area (EEA) and want to do their bachelor’s or master’s in the Netherlands. Several Dutch research universities and universities of applied sciences, along with the Dutch Ministry of Education, Culture, and Science, are funding this Europe scholarship. Students who will complete the Research Master’s program will be well-equipped to pursue a Ph.D. in their area of study after graduation, as well as secure advisory roles in both the public and private sectors.  Through these Netherlands Scholarships for international students, brilliant individuals can study and live in one of the most enthralling nations in Europe while receiving an unmatched education. Students will take advantage of advanced training and research facilities, top-notch educational programs, and several international networking possibilities, in addition to having access to some of the most prestigious Dutch universities in the Netherlands. Students will get a chance to work on research projects related to their area of study that they wish to do.  The Netherlands Government has partnered with 32 Dutch Universities that offer a variety of degree programs in this scholarship related to English language, International Relations, Psychology, Anthropology, Urban Studies, Philosophy, Linguistics, Data Science and Artificial Intelligence, Arts Media and Society, Law, Social Sciences, Marketing, Human Resource Management, Governance, Health wellbeing and Society, Supply Chain, Accountancy, Economics, Business Analytics and Operations Research, Business Taxation, Quantitative Finance, Child psychology, Econometrics, Entrepreneurship, Communication and Cognition, Ethics of Business and Organization, Engineering and Innovation.  Students will get to explore landmarks of Europe while residing there which otherwise is merely a dream for many individuals due to financial constraints. With NetherlandsGovernment Scholarshipin your hands, this is a fantastic chance to advance your academic career and learn a new skill set. These will be helpful in the professional life and overall personality development of students. Any student who wants to achieve success in their chosen sector should use it as an expedient chance.","https://scholarshipscorner.website/netherlands-government-scholarship/","https://www.studyinnl.org/finances/nl-scholarship","","Applicants applying must:","Netherlands","32 different Dutch Universities","","","Europe","2025-04-01"
"58","Global Leaders’ Scholarship Program in UK 2025 | Full Scholarship","Stephen Young Global Leaders’ Scholarship Program (SYGL) 2025 will award full scholarship to outstanding students enrolled in MBA at University of Strathclyde Glasgow. ThisMBA scholarshipis all about building strong leadership skills. It’s designed to help scholars become leaders who make a positive impact and support responsible, sustainable business growth. Students will get coaching and support by a business leader, CEO or any senior executive of a renowned company with an industry focus.  In this MBA scholarship in UK, students will get a chance to take advantage from various leadership factors through Stephen Young Institute (SYI) and become a member of SYI community. Thisinternational scholarshipof practical learning will support students’ development as future global leaders. SYGL scholarship Program in Europe will help participants to acquire critical competencies which are important in today’s competitive and rapidly evolving global marketplace.  During this fullscholarship program for international students, scholars can select one out of three opportunities offered to them in addition to their MBA studies. First is to attend a global MBA elective class in Europe, Middle East, or Far East which will provide airfare and accommodation. Second is to attend an international summer school in another partner university which will include air tickets and accommodation. Third is to take up a special research project defined by Stephen Business Institute.","https://scholarshipscorner.website/global-leaders-scholarship-program/","https://www.strath.ac.uk/studywithus/scholarships/stephenyounggloballeadersprogramme/#apply","","Applicants must meet the admissions criteria for the Strathclyde full-time MBA program.Applicants must receive an admission offer to study MBA program in the university before applying for the scholarship.Applicants have to apply separately to the Stephen Young Global Leaders’ Scholarship Program.Applicants should demonstrate excellent academic record in their scholarship application.Applicants must be self-funded students who do not have access to other funding sources.Short-listed candidates will have an interview (in-person or online).Duplicate applications will be disqualified.
CheckDAAD Helmut Schmidt Programme 2026 in Germany | Fully Funded","UK","University of Strathclyde Glasgow","Full-time MBA (1 year)","","Europe","2025-04-01"
"1","Mandela Rhodes Scholarship for African Students 2026 | Fully Funded","The Mandela Rhodes Scholarship 2026 is a fully funded opportunity for young African leaders to pursue postgraduate studies in South Africa. Covering tuition, accommodation, meals, and travel, this prestigious scholarship also includes a leadership development program. It focuses on education, reconciliation, entrepreneurship, and leadership, helping scholars grow intellectually and personally. This Mandela scholarship program empowers individuals to create positive change in their communities while upholding equality, human dignity, and social justice. This scholarship in South Africa provides a life-changing experience through a structured leadership development program. Scholars participate in week-long residential workshops designed to enhance self-awareness, critical thinking, and innovation. The program builds a strong network of young African changemakers, fostering meaningful discussions on leadership and social impact. Recipients must enroll in a recognized South African university, ensuring access to world-class education while developing skills to lead and transform their societies. The Mandela Rhodes Foundation, one of Nelson Mandela’s three official legacy organizations, was established in 2003 in partnership with the Rhodes Trust. It continues Mandela’s mission to nurture future African leaders by providing financial and leadership support. Through this scholarship, young visionaries gain opportunities to shape Africa’s future by embracing innovation, equality, and empowerment. Applicants passionate about making a difference in Africa are encouraged to apply and become part of this transformational journey.","https://scholarshipscorner.website/mandela-rhodes-scholarship-for-african-students/","https://mandela-rhodes.embark.com/login/apply?target=2026&_gl=1*2uy8j4*_ga*MTY1MjAwMzk1MC4xNzQyMjQzMjY3*_ga_TWL8GTPF51*MTc0MjI0MzI2Ni4xLjEuMTc0MjI0MzM0My42MC4wLjA.","2025-04-21","Open to citizens of any African country.Applicants must be between 19 and 29 years old at the time of application.Must have a strong academic record, typically above 70% or upper-second class Honours.The scholarship is for postgraduate studies (Honours or Master’s degrees) in South African universities.You can apply if you are completing your undergraduate degree this year, but you must have your degree by January 1, 2026.Must be able to study in English, as all South African universities use English as the medium of instruction.","South Africa","","Honours Degree Program-1 yearMaster’s Degree Program-2 years","Honours Degree ProgramMaster’s Degree Program","Africa","2025-03-01"
"21","Australia Awards Scholarships 2026 | Fully Funded | Study in Australia","Australia Awards Scholarships 2025 is designed for students who desire to study at the most influential universities in Australia. Thesefully-funded scholarshipsare granted to everyone belonging to the eligible countries list. Considering your financial circumstances, the Government of Australia has introduced these opportunities for financially vulnerable students with a passion for learning and growing. Suppose you have a good academic background, excellent communication and negotiation skills, a result achiever, and the ability to make productive working relationships. In that case, you should take this chance to excel in an international environment. The AustralianGovernment Scholarshipintends to build your career on reality grounds while overcoming your financial burden. These international scholarship awards are long-term awards administered by the Department of Foreign Affairs and Trade. The Australian scholarships aim to contribute to Australia’s partner countries’ development through bilateral and regional agreements. The scholarships in Australia for international students are surrounded by multiple benefits, including the full tuition fee waiver, return airfare in economy class from the home country to Australia and vice versa, basic accommodation allowance, establishment allowance to cover the textbooks and study materials, overseas health coverage, and many others. You will be allowed to sign a contract with the Commonwealth of Australia declaring you liable to comply with the scholarship conditions to get this free Australian scholarship award. In 2024, the Australian Department of Foreign Affairs and Trade is awarding 989 Australia Awards scholarships to participants from 55 countries, investing approximately $250 million. These full scholarships are integral to Australia’s development policy, aiming to foster prosperity and reduce poverty. The Australia Awards, renowned for their transformative nature, offer leaders from developing countries comprehensive opportunities for academic and professional advancement in Australia.","https://scholarshipscorner.website/australia-awards-scholarships/","https://www.dfat.gov.au/people-to-people/australia-awards/Pages/how-to-apply-for-an-australia-awards-scholarship","2025-04-30","Everyone from the eligible country can apply.Your study program must be related to your country’s areas of development.Highly intellectual students will be preferred.Committed to leaving Australia after the completion of the scholarship.Each country has different eligibility criteria, kindly visit the official website for more details.","Australia","","","Undergraduate Degree ProgramMaster’s Degree ProgramPhD","Australia","2025-03-01"
"40","UEAU PhD Scholarship 2025 | Fully Funded | Study in UAE","The UEAU PhD Scholarship 2025 isafully-funded scholarship program for international studentswho have completed their Master’s degree and want to pursue their doctoral studies on scholarships in UAE.  The United Arab Emirates scholarship is available for high-achieving students.  The first and oldest research institute in the United Arab Emirates is United Arab Emirates University (UAEU), which was founded in 1976. The university currently has over 16,000 domestic and international students studying there from all around the world. Imagine getting selected for a UAE Scholarship and residing in the United Arab Emirates, which is known as a tourist destination where you will have the opportunity to meet like-minded people from all across the globe. The United Arab Emirates University scholarships offer international students a remarkable chance to engage with diverse cultures and acquire life-long experiences.  ThesePhD Scholarshipsin UAE offer financial support to deserving individuals who have a passion for studying and conducting research-related activities at a foreign university. UAEUscholarship for international studentsand domestic students offers a wide range of study programs including Humanities, Mass Communication, Geography, Arabic language, English language, Cellular and Molecular Biology, Chemistry, Mathematics, Physics, Geosciences, Leadership and Policy Studies, Language and Literacy Education, Special Education, Law, Food Science and Technology, Horticulture Science, Civil Engineering, Mechanical Engineering, Electrical Engineering, Chemical Engineering, Architecture  Engineering, Pharmacy, Public health, Biomedical Science, Nutritional Science and Informatics and Computing. Getting afull scholarshipin the Middle East can be fascinating yet desirable. If you have always aspired to explore the multi-ethnic culture of UAE, you should apply to the University of UAE. Without a doubt, studying in UAE on scholarship will be tied with various recreational activities which will make the learning experience more fun. This is a financially supported opportunity so 100% of tuition fees for this PhD program will be waived. Students will not have to worry about their cost of living because they will be provided with a monthly stipend.","https://scholarshipscorner.website/uae-university-phd-scholarship/","https://www.uaeu.ac.ae/en/cgs/phd_scholarship_all.shtml","2025-03-01","Applicants applying must:
Have a GPA equal to or greater than 3.5 out of 4 in Master’s degree.Not be employed anywhere.Not avail any other financial sponsorship.Meet all the requirements of PhD program.Have done their previous research project/ thesis related to Renewable Energy, Transportation, Health, Water, Technology or Space.","","United Arab Emirates University","","","Middle East","2025-02-01"
